{
  "case_id": "secrets-logging/request-log-control-001",
  "case_version": "1.0.0+sha256.ce3b988886bb700bbaf2986d8601587e2e941a66f8bb29ad73c7d19d134af17e",
  "category": "secrets-logging",
  "classification": "negative_control",
  "description": "A lookalike logging policy excludes request secret fields from allowlisted structured logs.",
  "fixture": {
    "credentials_included": false,
    "external_hosts": [],
    "files": [
      {
        "path": "logging-policy.json",
        "sha256": "7eae1023e1f470439b2551fb986261c3bac210705ba1a6ddc69b3a8dba557679"
      }
    ],
    "network_required": false,
    "non_deployable": true,
    "root": ".",
    "weaponized_payloads_included": false
  },
  "framework": "logging-policy-fixture",
  "ground_truth": {
    "negative_controls": [
      {
        "control_property": "Request secret fields are excluded while the structured logging allowlist remains enforced.",
        "id": "NC-010",
        "location": {
          "end_line": 4,
          "file": "logging-policy.json",
          "line": 3,
          "symbol": "allowlisted logging policy"
        },
        "resembles": "structured request-context logging",
        "taxonomy": [
          {
            "id": "CWE-532",
            "system": "CWE"
          }
        ]
      }
    ],
    "positive_findings": []
  },
  "language": "json",
  "limitations": [
    "This synthetic case is regression evidence only and does not establish production detection performance.",
    "The fixture is an inert policy or code model, not a deployable service, workflow, or exploit procedure."
  ],
  "public_safe": true,
  "schema_version": "1",
  "stage_expectations": {
    "optional": [
      "recon",
      "targets",
      "scanner-plan",
      "scanner-triage",
      "chains",
      "proofs",
      "evidence-graph"
    ],
    "prohibited": [
      "issue-publication"
    ],
    "required": [
      "target-research",
      "adversarial-validation",
      "metrics"
    ]
  },
  "title": "Allowlisted request-log negative control"
}
