{
  "case_id": "execution-boundaries/query-001",
  "case_version": "1.0.0+sha256.c9c07522c312c3d40b7b5f0b17fa01f78f0d996a037718f548d072b850291757",
  "category": "execution-boundaries",
  "classification": "positive",
  "description": "An inert query policy marks caller input as reaching a query without parameter binding.",
  "fixture": {
    "credentials_included": false,
    "external_hosts": [],
    "files": [
      {
        "path": "query-policy.json",
        "sha256": "b2926b553ee39ebd466a5a8c2082a53860b729fb905512450b8505404a91d94e"
      }
    ],
    "network_required": false,
    "non_deployable": true,
    "root": ".",
    "weaponized_payloads_included": false
  },
  "framework": "query-policy-fixture",
  "ground_truth": {
    "negative_controls": [],
    "positive_findings": [
      {
        "affected_locations": [
          {
            "end_line": 5,
            "file": "query-policy.json",
            "line": 3,
            "symbol": "query construction policy"
          }
        ],
        "entry_point": {
          "end_line": 5,
          "file": "query-policy.json",
          "line": 5,
          "symbol": "untrusted_input_reaches_query"
        },
        "id": "GT-008",
        "safe_remediation_property": "Caller-controlled values must be passed only through the query engine's parameter-binding interface.",
        "severity_range": {
          "maximum": "High",
          "minimum": "High"
        },
        "sink": {
          "end_line": 3,
          "file": "query-policy.json",
          "line": 3,
          "symbol": "query_parameters_bound"
        },
        "taxonomy": [
          {
            "id": "CWE-89",
            "system": "CWE"
          }
        ],
        "trust_boundary": "An inert query policy marks caller input as reaching a query without parameter binding.",
        "vulnerability_class": "unsafe-query-construction"
      }
    ]
  },
  "language": "json",
  "limitations": [
    "This synthetic case is regression evidence only and does not establish production detection performance.",
    "The fixture is an inert policy or code model, not a deployable service, workflow, or exploit procedure."
  ],
  "public_safe": true,
  "schema_version": "1",
  "stage_expectations": {
    "optional": [
      "recon",
      "targets",
      "scanner-plan",
      "scanner-triage",
      "chains",
      "proofs",
      "evidence-graph"
    ],
    "prohibited": [
      "issue-publication"
    ],
    "required": [
      "target-research",
      "adversarial-validation",
      "metrics"
    ]
  },
  "title": "Unbound input reaches fixed query boundary"
}
