{
  "case_id": "webhook-trust/signature-control-001",
  "case_version": "1.0.0+sha256.c674e6f3817d4fa13c47ff9a82e35f934ac60b8e1317c8e5136ad3563866c2da",
  "category": "webhook-trust",
  "classification": "negative_control",
  "description": "A lookalike webhook policy verifies the signature before parsing the untrusted event.",
  "fixture": {
    "credentials_included": false,
    "external_hosts": [],
    "files": [
      {
        "path": "webhook-policy.json",
        "sha256": "3b8aba625e833a187786e478128c70a6b5e4909de7e6d3e4261c87c015875065"
      }
    ],
    "network_required": false,
    "non_deployable": true,
    "root": ".",
    "weaponized_payloads_included": false
  },
  "framework": "webhook-policy-fixture",
  "ground_truth": {
    "negative_controls": [
      {
        "control_property": "Signature validation occurs before parsing while replay and event properties remain identical.",
        "id": "NC-009",
        "location": {
          "end_line": 5,
          "file": "webhook-policy.json",
          "line": 3,
          "symbol": "verified webhook policy"
        },
        "resembles": "untrusted webhook event parsing",
        "taxonomy": [
          {
            "id": "CWE-345",
            "system": "CWE"
          }
        ]
      }
    ],
    "positive_findings": []
  },
  "language": "json",
  "limitations": [
    "This synthetic case is regression evidence only and does not establish production detection performance.",
    "The fixture is an inert policy or code model, not a deployable service, workflow, or exploit procedure."
  ],
  "public_safe": true,
  "schema_version": "1",
  "stage_expectations": {
    "optional": [
      "recon",
      "targets",
      "scanner-plan",
      "scanner-triage",
      "chains",
      "proofs",
      "evidence-graph"
    ],
    "prohibited": [
      "issue-publication"
    ],
    "required": [
      "target-research",
      "adversarial-validation",
      "metrics"
    ]
  },
  "title": "Pre-parse signature negative control"
}
