{
  "case_id": "ai-agent-mcp/indirect-output-001",
  "case_version": "1.0.0+sha256.51bf33857abfcfd540faa7b648150e9aab63da2dc2fd4ab3d395e4f1f38f5a0b",
  "category": "ai-agent-mcp",
  "classification": "positive",
  "description": "An inert agent policy permits untrusted tool output to enter the follow-up instruction channel.",
  "fixture": {
    "credentials_included": false,
    "external_hosts": [],
    "files": [
      {
        "path": "agent-policy.json",
        "sha256": "25b5af557f6a8ed929e4ed31dc4a6b53bee1c92b9c1e09f2f118fb020a23fa41"
      }
    ],
    "network_required": false,
    "non_deployable": true,
    "root": ".",
    "weaponized_payloads_included": false
  },
  "framework": "agent-policy-fixture",
  "ground_truth": {
    "negative_controls": [],
    "positive_findings": [
      {
        "affected_locations": [
          {
            "end_line": 5,
            "file": "agent-policy.json",
            "line": 3,
            "symbol": "agent output policy"
          }
        ],
        "entry_point": {
          "end_line": 5,
          "file": "agent-policy.json",
          "line": 5,
          "symbol": "untrusted_output_reaches_followup_instruction"
        },
        "id": "GT-007",
        "safe_remediation_property": "Untrusted tool output must remain data, satisfy a bounded schema, and never become a follow-up instruction.",
        "severity_range": {
          "maximum": "High",
          "minimum": "High"
        },
        "sink": {
          "end_line": 5,
          "file": "agent-policy.json",
          "line": 5,
          "symbol": "follow-up instruction boundary"
        },
        "taxonomy": [
          {
            "id": "LLM01",
            "system": "OWASP-LLM"
          },
          {
            "id": "CWE-1427",
            "system": "CWE"
          }
        ],
        "trust_boundary": "An inert agent policy permits untrusted tool output to enter the follow-up instruction channel.",
        "vulnerability_class": "indirect-prompt-output-trust"
      }
    ]
  },
  "language": "json",
  "limitations": [
    "This synthetic case is regression evidence only and does not establish production detection performance.",
    "The fixture is an inert policy or code model, not a deployable service, workflow, or exploit procedure."
  ],
  "public_safe": true,
  "schema_version": "1",
  "stage_expectations": {
    "optional": [
      "recon",
      "targets",
      "scanner-plan",
      "scanner-triage",
      "chains",
      "proofs",
      "evidence-graph"
    ],
    "prohibited": [
      "issue-publication"
    ],
    "required": [
      "target-research",
      "adversarial-validation",
      "metrics"
    ]
  },
  "title": "Untrusted tool output becomes follow-up instruction"
}
