{
  "case_id": "github-actions/cache-control-001",
  "case_version": "1.0.0+sha256.bbae25f65e5842a21e8a6d05a3f8c0a59cc1156359302c6bb8a46a1ecd3728d9",
  "category": "github-actions",
  "classification": "negative_control",
  "description": "A lookalike automation model restores only reviewed base-revision cache content into the shared namespace.",
  "fixture": {
    "credentials_included": false,
    "external_hosts": [],
    "files": [
      {
        "path": "workflow-fixture.yml",
        "sha256": "af4da2a0a40c21db477fa7d00567c72e286baba9bf87da3a200f0bc42b0e54c2"
      }
    ],
    "network_required": false,
    "non_deployable": true,
    "root": ".",
    "weaponized_payloads_included": false
  },
  "framework": "workflow-model-fixture",
  "ground_truth": {
    "negative_controls": [
      {
        "control_property": "The cache source is a reviewed base revision while the other model properties remain identical.",
        "id": "NC-006",
        "location": {
          "end_line": 4,
          "file": "workflow-fixture.yml",
          "line": 2,
          "symbol": "reviewed cache model"
        },
        "resembles": "privileged automation restoring shared cache content",
        "taxonomy": [
          {
            "id": "CICD-SEC-9",
            "system": "OWASP-CI-CD"
          }
        ]
      }
    ],
    "positive_findings": []
  },
  "language": "yaml",
  "limitations": [
    "This synthetic case is regression evidence only and does not establish production detection performance.",
    "The fixture is an inert policy or code model, not a deployable service, workflow, or exploit procedure."
  ],
  "public_safe": true,
  "schema_version": "1",
  "stage_expectations": {
    "optional": [
      "recon",
      "targets",
      "scanner-plan",
      "scanner-triage",
      "chains",
      "proofs",
      "evidence-graph"
    ],
    "prohibited": [
      "issue-publication"
    ],
    "required": [
      "target-research",
      "adversarial-validation",
      "metrics"
    ]
  },
  "title": "Reviewed cache-source negative control"
}
