{
  "case_id": "webhook-trust/signature-001",
  "case_version": "1.0.0+sha256.0b5facb39775cfa3e187541a71e49a1286562300a2b3450a6b4a456f292eed29",
  "category": "webhook-trust",
  "classification": "positive",
  "description": "An inert webhook policy permits an untrusted event to be parsed before signature validation.",
  "fixture": {
    "credentials_included": false,
    "external_hosts": [],
    "files": [
      {
        "path": "webhook-policy.json",
        "sha256": "b7f678d74ea1d92e194418a709e71dcd35e00b5f03694cd6ae867eed96377559"
      }
    ],
    "network_required": false,
    "non_deployable": true,
    "root": ".",
    "weaponized_payloads_included": false
  },
  "framework": "webhook-policy-fixture",
  "ground_truth": {
    "negative_controls": [],
    "positive_findings": [
      {
        "affected_locations": [
          {
            "end_line": 5,
            "file": "webhook-policy.json",
            "line": 3,
            "symbol": "webhook trust policy"
          }
        ],
        "entry_point": {
          "end_line": 5,
          "file": "webhook-policy.json",
          "line": 5,
          "symbol": "untrusted_event_parsed"
        },
        "id": "GT-009",
        "safe_remediation_property": "The event signature and replay window must be validated before any untrusted event body is parsed or acted on.",
        "severity_range": {
          "maximum": "High",
          "minimum": "High"
        },
        "sink": {
          "end_line": 4,
          "file": "webhook-policy.json",
          "line": 4,
          "symbol": "signature_verified_before_parse"
        },
        "taxonomy": [
          {
            "id": "CWE-345",
            "system": "CWE"
          }
        ],
        "trust_boundary": "An inert webhook policy permits an untrusted event to be parsed before signature validation.",
        "vulnerability_class": "missing-webhook-signature-validation"
      }
    ]
  },
  "language": "json",
  "limitations": [
    "This synthetic case is regression evidence only and does not establish production detection performance.",
    "The fixture is an inert policy or code model, not a deployable service, workflow, or exploit procedure."
  ],
  "public_safe": true,
  "schema_version": "1",
  "stage_expectations": {
    "optional": [
      "recon",
      "targets",
      "scanner-plan",
      "scanner-triage",
      "chains",
      "proofs",
      "evidence-graph"
    ],
    "prohibited": [
      "issue-publication"
    ],
    "required": [
      "target-research",
      "adversarial-validation",
      "metrics"
    ]
  },
  "title": "Event parsed before signature validation"
}
