{
  "case_id": "github-actions/cache-target-001",
  "case_version": "1.0.0+sha256.d1ad7531d8144a1cc36e76c4e58fc55b8671e9bc8eb3da3035a09e63e3fec7c4",
  "category": "github-actions",
  "classification": "positive",
  "description": "An inert automation model restores contributor-controlled cache content into a shared privileged namespace.",
  "fixture": {
    "credentials_included": false,
    "external_hosts": [],
    "files": [
      {
        "path": "workflow-fixture.yml",
        "sha256": "530ba3bb761f4c064fa8e50f576328e9478b686013289f2d7543c181c6155613"
      }
    ],
    "network_required": false,
    "non_deployable": true,
    "root": ".",
    "weaponized_payloads_included": false
  },
  "framework": "workflow-model-fixture",
  "ground_truth": {
    "negative_controls": [],
    "positive_findings": [
      {
        "affected_locations": [
          {
            "end_line": 3,
            "file": "workflow-fixture.yml",
            "line": 2,
            "symbol": "cache trust model"
          }
        ],
        "entry_point": {
          "end_line": 2,
          "file": "workflow-fixture.yml",
          "line": 2,
          "symbol": "cache_restore_source"
        },
        "id": "GT-006",
        "safe_remediation_property": "Privileged cache restoration must be bound to reviewed content and an isolated trusted namespace.",
        "severity_range": {
          "maximum": "High",
          "minimum": "High"
        },
        "sink": {
          "end_line": 3,
          "file": "workflow-fixture.yml",
          "line": 3,
          "symbol": "cache_write_authority"
        },
        "taxonomy": [
          {
            "id": "CICD-SEC-9",
            "system": "OWASP-CI-CD"
          }
        ],
        "trust_boundary": "An inert automation model restores contributor-controlled cache content into a shared privileged namespace.",
        "vulnerability_class": "untrusted-cache-artifact"
      }
    ]
  },
  "language": "yaml",
  "limitations": [
    "This synthetic case is regression evidence only and does not establish production detection performance.",
    "The fixture is an inert policy or code model, not a deployable service, workflow, or exploit procedure."
  ],
  "public_safe": true,
  "schema_version": "1",
  "stage_expectations": {
    "optional": [
      "recon",
      "targets",
      "scanner-plan",
      "scanner-triage",
      "chains",
      "proofs",
      "evidence-graph"
    ],
    "prohibited": [
      "issue-publication"
    ],
    "required": [
      "target-research",
      "adversarial-validation",
      "metrics"
    ]
  },
  "title": "Untrusted cache enters privileged namespace"
}
