{
  "case_id": "python-web/authz-001",
  "case_version": "1.0.0+sha256.c50b85f8b2a209898e5359b07c03c779ea337d7051ff098e1c7b9b9dc18787dd",
  "category": "python-web",
  "classification": "positive",
  "description": "A local data selector accepts tenant context but selects a record by identifier alone.",
  "fixture": {
    "credentials_included": false,
    "external_hosts": [],
    "files": [
      {
        "path": "app.py",
        "sha256": "1732c964a1cd4d67a1060d378738dadb9bc7fbd58c58d4b79fad84d8608458a3"
      }
    ],
    "network_required": false,
    "non_deployable": true,
    "root": ".",
    "weaponized_payloads_included": false
  },
  "framework": "stdlib-fixture",
  "ground_truth": {
    "negative_controls": [],
    "positive_findings": [
      {
        "affected_locations": [
          {
            "end_line": 7,
            "file": "app.py",
            "line": 4,
            "symbol": "select_invoice"
          }
        ],
        "entry_point": {
          "end_line": 4,
          "file": "app.py",
          "line": 4,
          "symbol": "select_invoice.requested_id"
        },
        "id": "GT-001",
        "safe_remediation_property": "The record predicate must require both the requested identifier and the authenticated tenant identifier.",
        "severity_range": {
          "maximum": "High",
          "minimum": "High"
        },
        "sink": {
          "end_line": 7,
          "file": "app.py",
          "line": 7,
          "symbol": "select_invoice record predicate"
        },
        "taxonomy": [
          {
            "id": "CWE-862",
            "system": "CWE"
          }
        ],
        "trust_boundary": "A caller-controlled record identifier crosses into tenant-scoped data selection.",
        "vulnerability_class": "missing-tenant-authorization"
      }
    ]
  },
  "language": "python",
  "limitations": [
    "This small synthetic case does not establish performance on production repositories.",
    "The fixture models one defensive review decision and is not a deployable service or workflow."
  ],
  "public_safe": true,
  "schema_version": "1",
  "stage_expectations": {
    "optional": [
      "recon",
      "targets",
      "scanner-plan",
      "scanner-triage",
      "chains",
      "proofs",
      "evidence-graph"
    ],
    "prohibited": [
      "issue-publication"
    ],
    "required": [
      "target-research",
      "adversarial-validation",
      "metrics"
    ]
  },
  "title": "Missing tenant authorization predicate"
}
