{
  "case_id": "github-actions/pr-target-001",
  "case_version": "1.0.0+sha256.1ac4cc1d06cdd3dcaa90e9b117344b9265cd5f583636ef1fca00a944f8ff20e1",
  "category": "github-actions",
  "classification": "positive",
  "description": "A non-executable workflow model combines repository-write authority with contributor-controlled content.",
  "fixture": {
    "credentials_included": false,
    "external_hosts": [],
    "files": [
      {
        "path": "workflow-fixture.yml",
        "sha256": "eb5be34b53be1f928a90352894c9e4fa81f2b91296eda329d7ee6cfedf596b5b"
      }
    ],
    "network_required": false,
    "non_deployable": true,
    "root": ".",
    "weaponized_payloads_included": false
  },
  "framework": "workflow-model-fixture",
  "ground_truth": {
    "negative_controls": [],
    "positive_findings": [
      {
        "affected_locations": [
          {
            "end_line": 5,
            "file": "workflow-fixture.yml",
            "line": 2,
            "symbol": "privileged workflow model"
          }
        ],
        "entry_point": {
          "end_line": 4,
          "file": "workflow-fixture.yml",
          "line": 4,
          "symbol": "content_source"
        },
        "id": "GT-003",
        "safe_remediation_property": "Privileged automation must consume only reviewed base content or run with read-only authority.",
        "severity_range": {
          "maximum": "Critical",
          "minimum": "High"
        },
        "sink": {
          "end_line": 3,
          "file": "workflow-fixture.yml",
          "line": 3,
          "symbol": "permissions_model"
        },
        "taxonomy": [
          {
            "id": "CICD-SEC-4",
            "system": "OWASP-CI-CD"
          }
        ],
        "trust_boundary": "Contributor-controlled revision metadata crosses into a privileged automation context.",
        "vulnerability_class": "privileged-workflow-untrusted-content"
      }
    ]
  },
  "language": "yaml",
  "limitations": [
    "This small synthetic case does not establish performance on production repositories.",
    "The fixture models one defensive review decision and is not a deployable service or workflow."
  ],
  "public_safe": true,
  "schema_version": "1",
  "stage_expectations": {
    "optional": [
      "recon",
      "targets",
      "scanner-plan",
      "scanner-triage",
      "chains",
      "proofs",
      "evidence-graph"
    ],
    "prohibited": [
      "issue-publication"
    ],
    "required": [
      "target-research",
      "adversarial-validation",
      "metrics"
    ]
  },
  "title": "Privileged workflow consumes untrusted revision"
}
